id,author,category,keywords,parentcatid,parentcatcode,parentcatname,parentcatslug,provider,pubDate,status,subcategoryid,subcategorycode,subcategoryname,subcategoryparentid,subcategoryparentcode,subcategoryparentname,subcategoryparentslug,subcategoryslug,title,topic,url
5a4a3456670c7645a286b634,Sam Hodges,"News,US News","Column, Finance, TC, irs, Internal Revenue Service, IRS Data Verification Modernization Act of 2017, Open Banking, Payment Services Directive",5a42ed6e527d3d240b8140ea,IAB12,News,news,techcrunch,1514656854000,classified,5a44d8eb527d3d3ad9df95ba,IAB12-2,US News,5a42ed6e527d3d240b8140ea,IAB12,News,news,us_news,How a simple tech upgrade at the IRS could transform the economy,All,http://feedproxy.google.com/~r/Techcrunch/~3/aap6ol9YPxY/
5a4b828e670c7645a286b792,Martin Welker,"Technology,Artificial Intelligence","AI, Artificial Intelligence, techcrunch",5a42ed6e527d3d240b8140e4,IAB19,Technology,technology,techcrunch,1514871039000,classified,5a4468486f7af13a5a457c6b,IAB19-72,Artificial Intelligence,5a42ed6e527d3d240b8140e4,IAB19,Technology,technology,artificial_intelligence,Building AI systems that work is still hard,All,http://feedproxy.google.com/~r/Techcrunch/~3/lK8YDseQ9j0/
5a4b828e670c7645a286b796,Jon Russell,"News,Technology News","Asia, Media, bytedance, Toutiao, Chinese, Startup",5a42ed6e527d3d240b8140ea,IAB12,News,news,techcrunch,1514891426000,classified,5a4b39e40978e16b1b883b98,IAB12-10,Technology News,5a42ed6e527d3d240b8140ea,IAB12,News,news,technology_news,Fast-growing Chinese media startup ByteDance enters 2018 with some uncertainty,All,http://feedproxy.google.com/~r/Techcrunch/~3/XKSBEQkbN3k/
5a4b828e670c7645a286b798,Natasha Lomas,"News,International News","Apps, Government, Social, TC, social media, photo sharing, instagram, Telegram, Facebook, Instant Messaging, social messaging, iran, Pavel Durov, censorship",5a42ed6e527d3d240b8140ea,IAB12,News,news,techcrunch,1514890981000,classified,5a4b39850978e16b1b883b97,IAB12-9,International News,5a42ed6e527d3d240b8140ea,IAB12,News,news,international_news,Telegram and Instagram being restricted in Iran,All,http://feedproxy.google.com/~r/Techcrunch/~3/cbAyGL1Xv68/
5a4b8305670c7645a286b7a5,Clive Thompson,"Business,Technology","magazine-26.01, clean tech, clean energy, Solar, blockchain",5a42ed6e527d3d240b8140d4,IAB3,Business,business,wired,1514818800000,classified,5a4468486f7af13a5a457c61,IAB3-13,Technology,5a42ed6e527d3d240b8140d4,IAB3,Business,business,technology,Clean Energy Is a Bright Spot Amid a Dark Tech Cloud,Business,https://www.wired.com/story/the-sunny-optimism-of-clean-energy-shines-through-techs-gloom
5a4b8305670c7645a286b7a8,Victoria Law,"Business,Technology","bail, apps, criminal justice",5a42ed6e527d3d240b8140d4,IAB3,Business,business,wired,1514894400000,classified,5a4468486f7af13a5a457c61,IAB3-13,Technology,5a42ed6e527d3d240b8140d4,IAB3,Business,business,technology,This App Collects Spare Change to Bail People Out of Jail,Business,https://www.wired.com/story/this-app-collects-spare-change-to-bail-people-out-of-jail
5a4b83f6670c7645a286b7cf,Steve Dent,"News,US News","Airports, Customs, Delays, DHS, gear, Passports, security, transportation, US Customs",5a42ed6e527d3d240b8140ea,IAB12,News,news,Engadget,1514880120000,classified,5a44d8eb527d3d3ad9df95ba,IAB12-2,US News,5a42ed6e527d3d240b8140ea,IAB12,News,news,us_news,A US customs computer snafu caused major airport delays,Technology,https://www.engadget.com/2018/01/02/a-us-customs-computer-snafu-caused-major-airport-delays/
5a4b83f6670c7645a286b7d3,Jon Fingas,"Technology,Mobile","android, android8.0, androidoreo, beta, gear, mobile, oneplus, oneplus 5t, open beta, oreo, oxygenos, smartphone",5a42ed6e527d3d240b8140e4,IAB19,Technology,technology,Engadget,1514851320000,classified,5a4468486f7af13a5a457c60,IAB19-67,Mobile,5a42ed6e527d3d240b8140e4,IAB19,Technology,technology,mobile,Adventurous OnePlus 5T owners can try Android Oreo,Technology,https://www.engadget.com/2018/01/01/oneplus-5t-android-oreo-beta/
5a4b8432670c7645a286b7d5,Jon Fingas,"Technology,Gadgets","egypt, egyptology, gadgetry, gadgets, gear, history, mummy, papyrus, scanner, scanning, university college london",5a42ed6e527d3d240b8140e4,IAB19,Technology,technology,Engadget,1514807880000,classified,5a4470ab527d3d3ad9df9553,IAB19-84,Gadgets,5a42ed6e527d3d240b8140e4,IAB19,Technology,technology,gadgets,Scanning technique reads hidden writing in mummy boxes,Technology,https://www.engadget.com/2018/01/01/scanners-can-read-hidden-writing-in-mummy-boxes/
5a4b8432670c7645a286b7d9,Cherlynn Low,"News,Technology News","facebook, gear, germany, hatespeech, internet, law, socialmedia",5a42ed6e527d3d240b8140ea,IAB12,News,news,Engadget,1514829840000,classified,5a4b39e40978e16b1b883b98,IAB12-10,Technology News,5a42ed6e527d3d240b8140ea,IAB12,News,news,technology_news,Germany's hefty hate speech fines for social networks start today,Technology,https://www.engadget.com/2018/01/01/germanys-hefty-hate-speech-fines-for-social-networks-start-toda/
5a4b8432670c7645a286b7dc,Jessica Conditt,"Technology,Gaming","av, bluehole, capture, gaming, minkonet, personal computing, personal computing, player unknowns battlegrounds, pubg, replay, twitch, youtube, youtube gaming",5a42ed6e527d3d240b8140e4,IAB19,Technology,technology,Engadget,1514824200000,classified,5a4468486f7af13a5a457c67,IAB19-68,Gaming,5a42ed6e527d3d240b8140e4,IAB19,Technology,technology,gaming,'PUBG' is quietly changing video games with its 3D replay technology,Technology,https://www.engadget.com/2018/01/01/pubg-playerunknowns-battlegrounds-3d-replay-minkonet-future/
5a4b85d7670c7645a286b820,Maria Popova,"Society,Culture","BOOKS, CULTURE, JOHN O'DONOHUE, PHILOSOPHY, POLITICS",5a42ed6e527d3d240b8140df,IAB14,Society,society,Brain Pickings,1514825504000,classified,5a4468486f7af13a5a457c5d,IAB14-9,Culture,5a42ed6e527d3d240b8140df,IAB14,Society,society,Culture,A Gentle Corrective for the Epidemic of Identity Politics Turning Us on Each Other and on Ourselves,Culture,http://feedproxy.google.com/~r/brainpickings/rss/~3/xMlCvohcU0g/
5a4cd40e670c7645a286b97b,Matthew Panzarino,"Technology,Startup","TC, TechCrunch Startup Battlefield Dubai, Startup Battlefield, techcrunch startup battlefield, Startup Battlefield Dubai",5a42ed6e527d3d240b8140e4,IAB19,Technology,technology,techcrunch,1514981126000,classified,5a4468486f7af13a5a457c5e,IAB19-65,Startup,5a42ed6e527d3d240b8140e4,IAB19,Technology,technology,startup,Apply today for TechCrunch's Startup Battlefield Dubai,All,http://feedproxy.google.com/~r/Techcrunch/~3/5jTgODywBuw/
5a4cd40e670c7645a286b97c,Ingrid Lunden,"Business,Acquisition","China, didi, Brazil, 99, deal, acquisition",5a42ed6e527d3d240b8140d4,IAB3,Business,business,techcrunch,1514982683000,classified,5a4468486f7af13a5a457c62,IAB3-14,Acquisition,5a42ed6e527d3d240b8140d4,IAB3,Business,business,acquisition,Report: China's Didi to buy Brazil's 99 in $1B deal to take on Latin America,All,http://feedproxy.google.com/~r/Techcrunch/~3/_oIIXoCXbA8/
5a4cd485670c7645a286b995,Erin Griffith,"Business,Startup","blockchain, cryptocurrency, startups",5a42ed6e527d3d240b8140d4,IAB3,Business,business,wired,1514980800000,classified,5a4db5ab9081ed0ff24b08d1,IAB3-19,Startup,5a42ed6e527d3d240b8140d4,IAB3,Business,business,startup,Is Your Startup Stalled? Pivot to Blockchain,Business,https://www.wired.com/story/is-your-startup-stalled-pivot-to-blockchain
5a4cd4fd670c7645a286b9a5,Graeme McMillan,"Society,Culture","comics, DC Entertainment, dc comics, Justice League",5a42ed6e527d3d240b8140df,IAB14,Society,society,wired,1514980800000,classified,5a4468486f7af13a5a457c5d,IAB14-9,Culture,5a42ed6e527d3d240b8140df,IAB14,Society,society,Culture,Inside DC's Controversial 'Watchmen' and Justice League Crossover,Culture,https://www.wired.com/story/doomsday-clock-watchmen-justice-league
5a4cd5ee670c7645a286b9d2,Steve Dent,"Technology,AeroSpace","falcon heavy, gear, rocket, space, spacex, static firing, test, video",5a42ed6e527d3d240b8140e4,IAB19,Technology,technology,Engadget,1514980860000,classified,5a4b51510978e16b1b883bb4,IAB19-86,AeroSpace,5a42ed6e527d3d240b8140e4,IAB19,Technology,technology,aerospace,SpaceX shows a video flyby of its Falcon Heavy rocket,Technology,https://www.engadget.com/2018/01/03/spacex-falcon-rocket-video-tour/
5a4e27ea670c7645a286bbcb,Nick Summers,"[ ""Technology"", ""Transportation"" ]","automation, driverless trains, gear, glasgow, glasgow subway, scotland, tomorrow, transportation",5a42ed6e527d3d240b8140e4,IAB19,Technology,technology,Engadget,1515068700000,classified,5a4e2b9c8744ee7d5b5b6fa3,IAB19-87,Transportation,5a42ed6e527d3d240b8140e4,IAB19,Technology,technology,transportation,Glasgow subway trains will be the UK's first with no staff,Technology,https://www.engadget.com/2018/01/04/glasgow-subway-trains-driverless-staff-uk/
5a4f7786670c7645a286bd61,Jon Russell,"[ ""Technology"", ""Facebook"" ]","Techcrunch, Zuckerberg, Facebook, Blockchain",5a42ed6e527d3d240b8140e4,IAB19,Technology,technology,techcrunch,1515151406000,classified,5a4468486f7af13a5a457c6e,IAB19-75,Facebook,5a42ed6e527d3d240b8140e4,IAB19,Technology,technology,facebook,Mark Zuckerberg is right to explore the potential of the blockchain for Facebook,All,http://feedproxy.google.com/~r/Techcrunch/~3/RrPbtt4_TaQ/
5a521afe670c7645a286c151,Brian Heater,"[ ""Technology"", ""Google"" ]","Artificial Intelligence, Hardware, CES 2018, Google, Assistant, Google Assistant",5a42ed6e527d3d240b8140e4,IAB19,Technology,technology,techcrunch,1515277632000,classified,5a4468486f7af13a5a457c6c,IAB19-73,Google,5a42ed6e527d3d240b8140e4,IAB19,Technology,technology,google,Google has planted its flag at CES,All,http://feedproxy.google.com/~r/Techcrunch/~3/um8y5h_a8Dg/
5a521d1a670c7645a286c1ac,Tom Simonite,"[ ""Technology"", ""Security"" ]","facebook, privacy, software",5a42ed6e527d3d240b8140e4,IAB19,Technology,technology,wired,1515326400000,classified,5a4468486f7af13a5a457c5c,IAB19-64,Security,5a42ed6e527d3d240b8140e4,IAB19,Technology,technology,security,Facebook Bug Could Let Advertisers Get Your Phone Number,Business,https://www.wired.com/story/facebook-bug-could-let-advertisers-see-your-phone-number
5a521e0a670c7645a286c1cf,Jon Fingas,"[ ""Technology"", ""Security"" ]","breach, data breach, florida, gear, government, healthcare, internet, medicaid, phishing, privacy, security",5a42ed6e527d3d240b8140e4,IAB19,Technology,technology,Engadget,1515326580000,classified,5a4468486f7af13a5a457c5c,IAB19-64,Security,5a42ed6e527d3d240b8140e4,IAB19,Technology,technology,security,"Florida phishing attack exposes data for 30,000 Medicaid recipients",Technology,https://www.engadget.com/2018/01/07/florida-phishing-attack-exposes-data-for-30-000-medicaid-recipie/
5a521e47670c7645a286c1d5,Jon Fingas,"[ ""Science"", ""Medicine"" ]","crispr, crisprcas9, gear, gene editing, genetics, health, medicine, science, tomorrow",5a42ed6e527d3d240b8140e0,IAB15,Science,science,Engadget,1515305100000,classified,5a52e8b22d78da4f8509a649,IAB15-3,Medicine,5a42ed6e527d3d240b8140e0,IAB15,Science,science,medicine,Key CRISPR gene editing methods might not work for most humans,Technology,https://www.engadget.com/2018/01/07/crispr-gene-editing-methods-might-not-work-for-most-humans/
5a521e47670c7645a286c1d6,Mariella Moon,"[ ""Technology"", ""Streaming"" ]","amazon, anime, anime strike, entertainment, internet, primevideo",5a42ed6e527d3d240b8140e4,IAB19,Technology,technology,Engadget,1515298260000,classified,5a4468486f7af13a5a457c69,IAB19-70,Streaming,5a42ed6e527d3d240b8140e4,IAB19,Technology,technology,streaming,Amazon folds its little-known anime service into Prime Video,Technology,https://www.engadget.com/2018/01/06/amazon-kills-anime-strike-prime-video/
5a521e47670c7645a286c1d7,Richard Lawler,"[ ""Technology"", ""Audio Video"" ]","av, ces2018, gear, lg, lgdisplay, oled, rollable",5a42ed6e527d3d240b8140e4,IAB19,Technology,technology,Engadget,1515296640000,classified,5a4468486f7af13a5a457c5f,IAB19-66,Audio Video,5a42ed6e527d3d240b8140e4,IAB19,Technology,technology,audio_video,LG Display delivers a 65-inch rollable OLED,Technology,https://www.engadget.com/2018/01/06/lg-display-delivers-a-65-inch-rollable-oled/
5a521e47670c7645a286c1d8,Jon Fingas,"[ ""Technology"", ""Gaming"" ]","epic games, fortnite, games, gaming, gear, internet, meltdown, multiplayer, personal computing, security, video games",5a42ed6e527d3d240b8140e4,IAB19,Technology,technology,Engadget,1515292380000,classified,5a4468486f7af13a5a457c67,IAB19-68,Gaming,5a42ed6e527d3d240b8140e4,IAB19,Technology,technology,gaming,Epic pins 'Fortnite' server woes on Meltdown patches,Technology,https://www.engadget.com/2018/01/06/epic-blames-meltdown-patches-on-fortnite-problems/
5a521e47670c7645a286c1d9,Nathan Ingraham,"[ ""Technology"", ""Google"" ]","ai, ces2018, gear, google, google assistant, lasvegas, monorail, personal computing, personalcomputing, robots, services, voice assistant",5a42ed6e527d3d240b8140e4,IAB19,Technology,technology,Engadget,1515287940000,classified,5a4468486f7af13a5a457c6c,IAB19-73,Google,5a42ed6e527d3d240b8140e4,IAB19,Technology,technology,google,Why is Google taking over Vegas for CES 2018?,Technology,https://www.engadget.com/2018/01/06/google-assistant-taking-over-CES-2018/
5a521e47670c7645a286c1da,Mariella Moon,"[ ""News"", ""US News"" ]","border guard, border search, customs and border protection, directives, gear, privacy, security, transportation",5a42ed6e527d3d240b8140ea,IAB12,News,news,Engadget,1515284940000,classified,5a44d8eb527d3d3ad9df95ba,IAB12-2,US News,5a42ed6e527d3d240b8140ea,IAB12,News,news,us_news,US border guards searched 60 percent more devices in 2017,Technology,https://www.engadget.com/2018/01/06/us-border-guard-electronics-searches/
5a521e47670c7645a286c1db,David Lumb,"[ ""Technology"", ""Gadgets"" ]","ces, ces2018, chromebook, education, gear, hp, hp chromebook 11 g6, personal computing",5a42ed6e527d3d240b8140e4,IAB19,Technology,technology,Engadget,1515279600000,classified,5a4470ab527d3d3ad9df9553,IAB19-84,Gadgets,5a42ed6e527d3d240b8140e4,IAB19,Technology,technology,gadgets,HP updates its Chromebook lineup with 11- and 14-inch models,Technology,https://www.engadget.com/2018/01/06/hp-updates-its-chromebook-lineup-with-11-and-14-inch-models/
5a521e47670c7645a286c1dc,Jon Fingas,"[ ""News"", ""International News"" ]","apollo, astronaut, gear, gemini, john young, moon, nasa, space, space shuttle, video",5a42ed6e527d3d240b8140ea,IAB12,News,news,Engadget,1515274260000,classified,5a4b39850978e16b1b883b97,IAB12-9,International News,5a42ed6e527d3d240b8140ea,IAB12,News,news,international_news,Original Space Shuttle commander John Young dies,Technology,https://www.engadget.com/2018/01/06/astronaut-john-young-dies/
5a521e47670c7645a286c1dd,Jon Fingas,"[ ""Technology"", ""Gadgets"" ]","acer, ces2018, computer, corei9, desktop, gaming, gear, laptop, nitro5, pc, personal computing, personalcomputing, predator, predator orion 9000, ryzen mobile",5a42ed6e527d3d240b8140e4,IAB19,Technology,technology,Engadget,1515268800000,classified,5a4470ab527d3d3ad9df9553,IAB19-84,Gadgets,5a42ed6e527d3d240b8140e4,IAB19,Technology,technology,gadgets,Acer's new gaming PCs include an 18-core liquid-cooled desktop,Technology,https://www.engadget.com/2018/01/06/acer-predator-orion-9000-and-nitro-5/
5a521e47670c7645a286c1de,David Lumb,"[ ""Technology"", ""Gadgets"" ]","acer, acer chromebook 11, ces2018, chromebook, gear, google, laptop, personal computing, personalcomputing",5a42ed6e527d3d240b8140e4,IAB19,Technology,technology,Engadget,1515268800000,classified,5a4470ab527d3d3ad9df9553,IAB19-84,Gadgets,5a42ed6e527d3d240b8140e4,IAB19,Technology,technology,gadgets,Acer's latest Chromebook offers 10 hours of battery for $250,Technology,https://www.engadget.com/2018/01/06/acer-s-latest-chromebook-offers-10-hours-of-battery-for-250/
5a5a030e670c7645a286cca5,Geek's Guide to the Galaxy,"[ ""Society"", ""Culture"" ]","Geek's Guide to the Galaxy, TV",5a42ed6e527d3d240b8140df,IAB14,Society,society,wired,1515844800000,classified,5a4468486f7af13a5a457c5d,IAB14-9,Culture,5a42ed6e527d3d240b8140df,IAB14,Society,society,Culture,'Black Mirror' Should Not Be a Shared Universe,Culture,https://www.wired.com/2018/01/geeks-guide-black-mirror-universe
5a5a03ff670c7645a286ccc5,Lucas Matney,"[ ""Technology"", ""Apple"" ]","TC, Apple, china, icloud",5a42ed6e527d3d240b8140e4,IAB19,Technology,technology,techcrunch,1515813485000,classified,5a4468486f7af13a5a457c6d,IAB19-74,Apple,5a42ed6e527d3d240b8140e4,IAB19,Technology,technology,apple,Apple says iCloud China data migration notice sent to some users in error,All,http://feedproxy.google.com/~r/Techcrunch/~3/H_GjMXT-TVs/
5a5a0747670c7645a286cd54,Mallory Locklear,"[ ""Technology"", ""Gaming"" ]","av, easports, emls, entertainment, esports, fifa18, fifa18globalseries, fifaeworldcup, football, gaming, majorleaguesoccer, paxeast, soccer",5a42ed6e527d3d240b8140e4,IAB19,Technology,technology,Engadget,1515830220000,classified,5a4468486f7af13a5a457c67,IAB19-68,Gaming,5a42ed6e527d3d240b8140e4,IAB19,Technology,technology,gaming,Major League Soccer is creating its own FIFA eSports league,Technology,https://www.engadget.com/2018/01/13/major-league-soccer-fifa-esports-league/
5a5a0747670c7645a286cd55,Mariella Moon,"[ ""Technology"", ""Mobile"" ]","gear, mobile, google play, porn ads",5a42ed6e527d3d240b8140e4,IAB19,Technology,technology,Engadget,1515834180000,classified,5a4468486f7af13a5a457c60,IAB19-67,Mobile,5a42ed6e527d3d240b8140e4,IAB19,Technology,technology,mobile,63 games and apps on Google Play served porn ads,Technology,https://www.engadget.com/2018/01/13/adultswine-porn-ads-on-apps/
5a5a0747670c7645a286cd56,Mallory Locklear,"[ ""News"", ""US News"" ]","amazon, daca, donaldtrump, donation, dreamers, facebook, gear, google, jeffbezos, politics, scholarship, services, thedream.us",5a42ed6e527d3d240b8140ea,IAB12,News,news,Engadget,1515819420000,classified,5a44d8eb527d3d3ad9df95ba,IAB12-2,US News,5a42ed6e527d3d240b8140ea,IAB12,News,news,us_news,Bezos family donates $33 million to Dreamers scholarship program,Technology,https://www.engadget.com/2018/01/12/bezos-donates-33-million-dreamers-scholarship/
5a5a0747670c7645a286cd57,Swapna Krishna,"[ ""Technology"", ""AeroSpace"" ]","4k, carbonite-2, earth-i, gaming, gear, satellite, space, tomorrow, vivid-i",5a42ed6e527d3d240b8140e4,IAB19,Technology,technology,Engadget,1515837660000,classified,5a4b51510978e16b1b883bb4,IAB19-86,AeroSpace,5a42ed6e527d3d240b8140e4,IAB19,Technology,technology,aerospace,Prototype satellite makes way for 4K 'Earth observation',Technology,https://www.engadget.com/2018/01/13/prototype-satellite-earth-observation-full-color-motion-video/
5a5a0747670c7645a286cd58,David Lumb,"[ ""Technology"", ""Crypto Currencies"" ]","bitcoin, cryptocurrency, food, friedchicken, kfc, services",5a42ed6e527d3d240b8140e4,IAB19,Technology,technology,Engadget,1515843360000,classified,5a446c8c3139fa3abfb1ac81,IAB19-83,Crypto Currencies,5a42ed6e527d3d240b8140e4,IAB19,Technology,technology,crypto_currencies,Bitcoin was briefly legal tender at KFC Canada,Technology,https://www.engadget.com/2018/01/13/bitcoin-was-briefly-legal-tender-at-kfc-canada/
5a5df78e670c7645a286d25b,Zeynep Tufekci,"[ ""Business"", ""Technology"" ]","free speech, censorship, media, social media",5a42ed6e527d3d240b8140d4,IAB3,Business,business,wired,1516100400000,classified,5a4468486f7af13a5a457c61,IAB3-13,Technology,5a42ed6e527d3d240b8140d4,IAB3,Business,business,technology,It's the (Democracy-Poisoning) Golden Age of Free Speech,Business,https://www.wired.com/story/free-speech-issue-tech-turmoil-new-censorship
5a5df78e670c7645a286d25f,Steven Johnson,"[ ""Business"", ""Technology"" ]","free speech, CloudFlare, internet, Nazis",5a42ed6e527d3d240b8140d4,IAB3,Business,business,wired,1516100400000,classified,5a4468486f7af13a5a457c61,IAB3-13,Technology,5a42ed6e527d3d240b8140d4,IAB3,Business,business,technology,Why Cloudflare Let an Extremist Stronghold Burn,Business,https://www.wired.com/story/free-speech-issue-cloudflare
5a5df78e670c7645a286d260,Alice Gregory,"[ ""Business"", ""Technology"" ]","free speech, smartphones, startups, psychology, Yondr",5a42ed6e527d3d240b8140d4,IAB3,Business,business,wired,1516100400000,classified,5a4468486f7af13a5a457c61,IAB3-13,Technology,5a42ed6e527d3d240b8140d4,IAB3,Business,business,technology,Yondr Wants to Neutralize Your Phone‰ÛÓand Un-change the World,Business,https://www.wired.com/story/free-speech-issue-yondr-smartphones
5a5df78e670c7645a286d262,Mark Harris,"[ ""Business"", ""Technology"" ]","Self-Driving Cars, Google, Uber, Anthony Levandowski",5a42ed6e527d3d240b8140d4,IAB3,Business,business,wired,1516104000000,classified,5a4468486f7af13a5a457c61,IAB3-13,Technology,5a42ed6e527d3d240b8140d4,IAB3,Business,business,technology,"Ex-Uber Engineer Accused of Spying on Tesla, Stealing Trade Secrets",Business,https://www.wired.com/story/anthony-levandowski-faces-new-claims-of-stealing-trade-secrets
5a5df8f5670c7645a286d2a0,Natasha Lomas,"[ ""Technology"", ""Internet Technology"" ]","Apps, Asia, Social, TC, social media, WhatsApp, spam, fake news, disinformation",5a42ed6e527d3d240b8140e4,IAB19,Technology,technology,techcrunch,1516104717000,classified,5a4468486f7af13a5a457c2f,IAB19-18,Internet Technology,5a42ed6e527d3d240b8140e4,IAB19,Technology,technology,Internet_Technology,WhatsApp reportedly testing anti-chain letter spam warning,All,http://feedproxy.google.com/~r/Techcrunch/~3/yr9MSpU1OnE/
5a5dfb8a670c7645a286d309,Nicole Lee,"[ ""Technology"", ""Gadgets"" ]","av, business, ces, ces2018, facebook, gadgetry, gadgets, gear, hugobarra, oculus, personal computing, personalcomputing",5a42ed6e527d3d240b8140e4,IAB19,Technology,technology,Engadget,1516104000000,classified,5a4470ab527d3d3ad9df9553,IAB19-84,Gadgets,5a42ed6e527d3d240b8140e4,IAB19,Technology,technology,gadgets,Facebook's Hugo Barra says standalone headsets are key to social VR,Technology,https://www.engadget.com/2018/01/16/facebook-hugo-barra-standalone-vr/
5a5f490f670c7645a286d447,Jon Russell,"[ ""Business"", ""Technology"" ]","Apps, Asia, Collaborative Consumption, didi, ofo, mobike, bluegogo, bike sharing",5a42ed6e527d3d240b8140d4,IAB3,Business,business,techcrunch,1516188277000,classified,5a4468486f7af13a5a457c61,IAB3-13,Technology,5a42ed6e527d3d240b8140d4,IAB3,Business,business,technology,Didi has a brilliant plan to contain the threat of China's bike-sharing services,All,http://feedproxy.google.com/~r/Techcrunch/~3/DpJ3VQOykyU/
5a5f490f670c7645a286d448,Ron Miller,"[ ""Business"", ""VC Funding"" ]","Enterprise, Fundings & Exits, Security, TC, anomali, ThreatStream, threat detection",5a42ed6e527d3d240b8140d4,IAB3,Business,business,techcrunch,1516191802000,classified,5a608886562365630d3df864,IAB3-19,VC Funding,5a42ed6e527d3d240b8140d4,IAB3,Business,business,vc_funding,Anomali secures $40 million Series D led by Lumia Capital to scale threat detection solution,All,http://feedproxy.google.com/~r/Techcrunch/~3/R9YUD4k8NTA/
5a5f490f670c7645a286d449,Jon Russell,"[ ""Technology"", ""Google"" ]","Asia, Google, shenzhen, China",5a42ed6e527d3d240b8140e4,IAB19,Technology,technology,techcrunch,1516154080000,classified,5a4468486f7af13a5a457c6c,IAB19-73,Google,5a42ed6e527d3d240b8140e4,IAB19,Technology,technology,google,Google moves into Shenzhen in latest China expansion,All,http://feedproxy.google.com/~r/Techcrunch/~3/m30VBDWZrHM/
5a5f490f670c7645a286d44a,Ingrid Lunden,"[ ""Business"", ""VC Funding"" ]","Apps, Artificial Intelligence, Asia, Fundings & Exits, Media, TC, wattpad, reading, storytelling, literature, crowdsourced",5a42ed6e527d3d240b8140d4,IAB3,Business,business,techcrunch,1516188699000,classified,5a608886562365630d3df864,IAB3-19,VC Funding,5a42ed6e527d3d240b8140d4,IAB3,Business,business,vc_funding,Storytelling app Wattpad raises $51M at a $398M valuation,All,http://feedproxy.google.com/~r/Techcrunch/~3/8wDKzYtlAVY/
5a5f490f670c7645a286d44b,Fitz Tepper,"[ ""Technology"", ""Crypto Currencies"" ]","Cryptocurrency, Techcrunch, scam, ponzi, bitconnect, crypto",5a42ed6e527d3d240b8140e4,IAB19,Technology,technology,techcrunch,1516154306000,classified,5a446c8c3139fa3abfb1ac81,IAB19-83,Crypto Currencies,5a42ed6e527d3d240b8140e4,IAB19,Technology,technology,crypto_currencies,"Bitconnect, which has been accused of running a Ponzi scheme, shuts down",All,http://feedproxy.google.com/~r/Techcrunch/~3/e3pQmFZ2iig/
5a5f490f670c7645a286d44e,Jon Russell,"[ ""Business"", ""Acquisition"" ]","Asia, Collaborative Consumption, Fundings & Exits, grab, Singapore, Southeast Asia",5a42ed6e527d3d240b8140d4,IAB3,Business,business,techcrunch,1516183265000,classified,5a4468486f7af13a5a457c62,IAB3-14,Acquisition,5a42ed6e527d3d240b8140d4,IAB3,Business,business,acquisition,Uber rival Grab acquires Indian startup to bulk up its mobile payment platform,All,http://feedproxy.google.com/~r/Techcrunch/~3/K8eyLI9yMDs/
5a5f494b670c7645a286d44f,Megan Rose Dickey,"[ ""Business"", ""Technology"" ]","Lawsuit, Media, TC, leo laporte, twit, Twitter",5a42ed6e527d3d240b8140d4,IAB3,Business,business,techcrunch,1516150377000,classified,5a4468486f7af13a5a457c61,IAB3-13,Technology,5a42ed6e527d3d240b8140d4,IAB3,Business,business,technology,"TWiT is suing Twitter, alleging breach of contract and copyright infringement",All,http://feedproxy.google.com/~r/Techcrunch/~3/Z-eXBmkI_kM/
5a5f494b670c7645a286d451,Taylor Hatmaker,"[ ""News"", ""US News"" ]","Government, Privacy, TC, U.S. Senate, senate, Congress, Section 702, mass surveillance, NSA",5a42ed6e527d3d240b8140ea,IAB12,News,news,techcrunch,1516147799000,classified,5a44d8eb527d3d3ad9df95ba,IAB12-2,US News,5a42ed6e527d3d240b8140ea,IAB12,News,news,us_news,"In a close vote, the Senate ends debate on warrantless surveillance of U.S. citizens",All,http://feedproxy.google.com/~r/Techcrunch/~3/8yRFHgOUm9M/
